oferta,precio,mts,bathrooms,recamaras,lat,lon,fuente,fecha_consulta,precio_m2
departamento en be grand alto polanco,4500000.0,100.0,,,19.4397595735,-99.1834480752,easyaviso,2025-05-09 13:25:53.299823,45000.0
departamento en venta en ritz carlton,35000000.0,,2.0,2.0,19.4237938,-99.1756269,easyaviso,2025-05-09 13:25:53.299823,
departamentos muy bien ubicados en la colonia san rafael,5865146.0,110.0,2.0,2.0,19.4383262,-99.1607888,easyaviso,2025-05-09 13:25:53.299823,53319.509090909094
departamento venta rio elba cuauhtemoc rdv614593,4700000.0,97.0,,2.0,19.4254137,-99.1749721,easyaviso,2025-05-09 13:25:53.299823,48453.60824742268
hermoso departamento en venta en san rafael.,3999000.0,87.0,,3.0,19.4398598,-99.1623461,easyaviso,2025-05-09 13:25:53.299823,45965.51724137931
departamento en preventa sep. 24  rio nazas,6400000.0,90.0,2.0,2.0,19.4313622,-99.1691016,easyaviso,2025-05-09 13:25:53.299823,71111.11111111111
departamento preventa xenter nuevo polanco,10350983.0,124.0,2.0,3.0,19.4437316,-99.182931,easyaviso,2025-05-09 13:25:53.299823,83475.66935483871
hermoso departamento en zona centrica col. san rafael,4900000.0,97.0,2.0,2.0,19.4373201,-99.1617645,easyaviso,2025-05-09 13:25:53.299823,50515.463917525776
departamentos en venta en col. cuauhtemoc cuauhtemoc,6300000.0,140.0,2.0,2.0,19.4277893,-99.171524,easyaviso,2025-05-09 13:25:53.299823,45000.0
departamento en venta en la colonia cuauhtemoc,6590000.0,52.59,,,19.4313622,-99.1691016,easyaviso,2025-05-09 13:25:53.299823,125308.99410534321
departamento en venta en la colonia cuauhtemoc,6150000.0,86.0,2.0,2.0,19.4311322,-99.1681413,easyaviso,2025-05-09 13:25:53.299823,71511.62790697675
oportunidad unica invierta en rio panuco cuauhtemoc. lujo y. confort,5950000.0,70.12,2.0,2.0,19.4298854,-99.1691796,easyaviso,2025-05-09 13:25:53.299823,84854.53508271535
san rafael bonito departamento en venta,4623900.0,74.0,2.0,2.0,19.4348791,-99.1615867,easyaviso,2025-05-09 13:25:53.299823,62485.13513513513
serapio rendon 21 depto en preventa 1 rec. con balcon  roof garden de 72m2,3250000.0,72.8,,,19.4384007861,-99.1598210231,easyaviso,2025-05-09 13:25:53.299823,44642.857142857145
departamento en venta san rafael,2800000.0,55.0,,2.0,19.4375426,-99.1608172,easyaviso,2025-05-09 13:25:53.299823,50909.09090909091
departamento en venta en cuauhtemoc,5100000.0,97.0,2.0,2.0,19.4286428,-99.1718132,easyaviso,2025-05-09 13:25:53.299823,52577.31958762887
preventas en altamirano san rafael,4417306.0,91.62,2.0,2.0,19.4432445,-99.1591588,easyaviso,2025-05-09 13:25:53.299823,48213.337699192314
penthouse a la venta  colonia cuauhtemoc en la calle rio ebro,8300000.0,256.0,3.0,4.0,19.4307209,-99.170468,easyaviso,2025-05-09 13:25:53.299823,32421.875
departamento preventa en veronica anzures,9200000.0,148.57,2.0,2.0,19.4357867,-99.1750638,easyaviso,2025-05-09 13:25:53.299823,61923.6723430033
departamento preventa en veronica anzures,7500000.0,120.85,,2.0,19.4357867,-99.1750638,easyaviso,2025-05-09 13:25:53.299823,62060.405461315684
departamento en preventa en veronica anzures,7200000.0,112.31,2.0,2.0,19.4357867,-99.1750638,easyaviso,2025-05-09 13:25:53.299823,64108.271747840794
departamento en preventa en veronica anzures,6800000.0,107.45,2.0,2.0,19.4357867,-99.1750638,easyaviso,2025-05-09 13:25:53.299823,63285.24895300139
departamento en venta en cuauhtemoc,7200000.0,134.0,2.0,2.0,19.4298684,-99.167721,easyaviso,2025-05-09 13:25:53.299823,53731.34328358209
venta departamento en col. cuauhtemoc con balcon,4600000.0,90.0,2.0,2.0,19.4258482,-99.1758964,easyaviso,2025-05-09 13:25:53.299823,51111.11111111111
departamento en venta en st regis con impresionante vista panoramica,20800000.0,120.0,,,19.4256427,-99.172342,easyaviso,2025-05-09 13:25:53.299823,173333.33333333334
paseo de la reforma 222,8900000.0,109.0,2.0,2.0,19.4255584,-99.1711814,easyaviso,2025-05-09 13:25:53.299823,81651.37614678899
departamento en venta en cuauhtemoc,5000000.0,72.0,2.0,2.0,19.432229,-99.1716626,easyaviso,2025-05-09 13:25:53.299823,69444.44444444444
departamento 77m2 con balcon 2 recamaras en cuauhtemoc preventa,5750000.0,77.2,2.0,2.0,19.4341434,-99.1693631,easyaviso,2025-05-09 13:25:53.299823,74481.86528497409
departamento 92m2 con terraza y balcon 2 recamaras en cuauhtemoc preventa,6250000.0,91.85,2.0,2.0,19.4311434,-99.1723631,easyaviso,2025-05-09 13:25:53.299823,68045.72672836146
departamento 147m2 con roof privado y balcon 2  recamaras en cuauhtemoc preventa,8350000.0,143.7,2.0,2.0,19.4351434,-99.1683631,easyaviso,2025-05-09 13:25:53.299823,58107.16771050801
st. regis magnifico departamento amueblado  venta y renta,52626240.0,190.0,2.0,2.0,19.4254096,-99.1721919,easyaviso,2025-05-09 13:25:53.299823,276980.2105263158
departamento de loft ritz carlton,13448928.0,58.44,,,19.4240425,-99.1757592,easyaviso,2025-05-09 13:25:53.299823,230132.23819301848
departamento amueblado renta venta en ritz carlton,77964800.0,240.0,2.0,2.0,19.4240425,-99.1757592,easyaviso,2025-05-09 13:25:53.299823,324853.3333333333
st. regis magnifico departamento amueblado en venta,50677120.0,190.0,2.0,2.0,19.4273694,-99.1684647,easyaviso,2025-05-09 13:25:53.299823,266721.6842105263
vendo lindo apartamento cuauhtemoc,5685000.0,72.0,2.0,2.0,19.4298854,-99.1691796,easyaviso,2025-05-09 13:25:53.299823,78958.33333333333
departamento en venta en cuauhtemoc 1 recamaras,5750000.0,75.0,2.0,,19.4262629,-99.1743598,easyaviso,2025-05-09 13:25:53.299823,76666.66666666667
departamento en preventa a una cuadra de reforma rio papaloapan 19502,6929880.0,74.5,2.0,2.0,19.4296229,-99.1653226,easyaviso,2025-05-09 13:25:53.299823,93018.52348993288
departamento en preventa a una cuadra de reforma rio papaloapan 19501,6850320.0,75.0,2.0,2.0,19.4296229,-99.1653226,easyaviso,2025-05-09 13:25:53.299823,91337.6
departamento en venta,5506520.0,94.94,2.0,2.0,19.4391447,-99.1551342,easyaviso,2025-05-09 13:25:53.299823,58000.0
departamento en venta,8300000.0,236.86,2.0,3.0,19.4371447,-99.1571342,easyaviso,2025-05-09 13:25:53.299823,35041.79684201638
torrre libertad cuauhtemoc departamento venta cdmx,31696000.0,183.0,3.0,2.0,19.4256427,-99.172342,easyaviso,2025-05-09 13:25:53.299823,173202.18579234972
super departamento remodelado y equipado en plaza grijalva,5900000.0,98.0,2.0,2.0,19.4340024,-99.1698862,easyaviso,2025-05-09 13:25:53.299823,60204.08163265306
departamento venta san rafael,6200000.0,91.6,2.0,2.0,19.4378137,-99.157614,easyaviso,2025-05-09 13:25:53.299823,67685.58951965066
departamento venta san rafael,5506520.0,94.94,2.0,2.0,19.4378137,-99.157614,easyaviso,2025-05-09 13:25:53.299823,58000.0
cuahutemoc departamentos cerca del angel de la independencia,6485000.0,96.0,2.0,2.0,19.4301322,-99.1691413,easyaviso,2025-05-09 13:25:53.299823,67552.08333333333
cuahutemoc departamentos cerca del angel de la independencia,4899000.0,77.0,2.0,2.0,19.4301322,-99.1691413,easyaviso,2025-05-09 13:25:53.299823,63623.37662337662
veronica anzures departamentoventamiguel hidalgocdmx,4785000.0,120.0,2.0,2.0,19.4349776,-99.1751599,easyaviso,2025-05-09 13:25:53.299823,39875.0
departamento en preventa  en san rafael,3389000.0,62.0,2.0,2.0,19.4354665,-99.1649706,easyaviso,2025-05-09 13:25:53.299823,54661.290322580644
ph de lujo bellas artes,8350000.0,150.0,,,19.6724918,-99.1796654,easyaviso,2025-05-09 13:25:53.299823,55666.666666666664
venta departamento en san rafael cuauhtemoc,5372640.0,84.0,2.0,2.0,19.4373442,-99.1642038,easyaviso,2025-05-09 13:25:53.299823,63960.0
departamento en venta a unas calles del angel de reforma,6760568.0,90.0,2.0,2.0,19.428275,-99.1701372,easyaviso,2025-05-09 13:25:53.299823,75117.42222222222
departamento en venta en rio rhin en cuauhtemoc,6525000.0,89.0,2.0,2.0,19.4333378,-99.1663083,easyaviso,2025-05-09 13:25:53.299823,73314.60674157304
en venta departamentos con balcon en rio nilo cuauhtemoc,7256321.0,76.0,2.0,2.0,19.4293215,-99.171978,easyaviso,2025-05-09 13:25:53.299823,95477.90789473684
nuevo departamento en venta rio guadalquivir,9991800.0,100.74,2.0,2.0,19.428275,-99.1701372,easyaviso,2025-05-09 13:25:53.299823,99184.03811792734
departamento nuevo en venta en rio guadalquivir cuauhtemoc,6647892.0,90.0,2.0,2.0,19.4284531,-99.170329,easyaviso,2025-05-09 13:25:53.299823,73865.46666666666
departamento ph en venta col.  san rafael,8300000.0,116.0,2.0,3.0,19.4364755,-99.1583026,easyaviso,2025-05-09 13:25:53.299823,71551.72413793103
departamento nuevo con balcon en venta cuauhtemoc,6417476.37,75.19,2.0,2.0,19.4254064,-99.1732245,easyaviso,2025-05-09 13:25:53.299823,85350.13126745578
departamento en venta residencial st regis paseo de la reforma,35084160.0,183.0,3.0,2.0,19.4256427,-99.172342,easyaviso,2025-05-09 13:25:53.299823,191716.7213114754
rio lerma  293 departamento en preventa 2 recamaras con  balcon desde 82.79 m2,6500000.0,82.9,2.0,2.0,19.4261645,-99.1743101,easyaviso,2025-05-09 13:25:53.299823,78407.7201447527
rio lerma  293 departamento en preventa 2 recamaras con balcon desde 92.10 m2,7450000.0,91.32,2.0,2.0,19.4261645,-99.1743101,easyaviso,2025-05-09 13:25:53.299823,81581.25273762594
departamento en venta en calle super tranquila de la cuauhtemoc,5980000.0,109.0,2.0,2.0,19.4359905,-99.169189,easyaviso,2025-05-09 13:25:53.299823,54862.38532110092
departamento nuevo en cuauhtemoc  en venta,6847000.0,90.0,2.0,2.0,19.4322751,-99.1675033,easyaviso,2025-05-09 13:25:53.299823,76077.77777777778
departamento en venta anahuac,5500000.0,97.0,2.0,2.0,19.436959,-99.1808795,easyaviso,2025-05-09 13:25:53.299823,56701.030927835054
departamento en venta cuauhtemoc,9991800.0,,2.0,2.0,19.428275,-99.1701372,easyaviso,2025-05-09 13:25:53.299823,
departamento a solo unos pasos del angel de la independencia.,6847892.0,90.0,2.0,2.0,19.4277791,-99.1699301,easyaviso,2025-05-09 13:25:53.299823,76087.6888888889
departamento 96m2 balcon 2 recamaras 2 banos cuauhtemoc,6485000.0,96.06,2.0,2.0,19.4303378,-99.1693083,easyaviso,2025-05-09 13:25:53.299823,67509.88965230064
venta departamento airbb  cuauhtemoc,6000000.0,92.0,2.0,2.0,19.4253782,-99.1743528,easyaviso,2025-05-09 13:25:53.299823,65217.391304347824
departamento en venta en be grand alto polanco,13900000.0,153.0,2.0,3.0,19.4401566,-99.1829788,easyaviso,2025-05-09 13:25:53.299823,90849.67320261437
departamento con 2 recamaras balcon y roof privado col san rafael 110m2,5865146.0,110.0,2.0,2.0,19.4383575,-99.1631888,easyaviso,2025-05-09 13:25:53.299823,53319.509090909094
con terraza 2 recamaras roof privado col san rafael 97m2,6080452.0,97.0,2.0,2.0,19.4393575,-99.1621888,easyaviso,2025-05-09 13:25:53.299823,62685.072164948455
departamento venta col. san rafael,5372640.0,97.0,2.0,3.0,19.4389929,-99.1635993,easyaviso,2025-05-09 13:25:53.299823,55388.0412371134
estrena preciosos departamentos de 2 recamaras en col. cuauhtemoc,5053000.0,73.0,2.0,2.0,19.4321765,-99.1717473,easyaviso,2025-05-09 13:25:53.299823,69219.17808219178
departamento marina nacional,4500000.0,60.0,2.0,,19.4376516,-99.1724718,easyaviso,2025-05-09 13:25:53.299823,75000.0
cuauhtemoc depto. frente al parque olof palme  para inversionista,6700000.0,119.0,2.0,2.0,19.4337147,-99.1705028,easyaviso,2025-05-09 13:25:53.299823,56302.52100840336
departamento a unas cuadras de la torre de pemex,1500000.0,42.0,,2.0,19.4423878,-99.1790259,easyaviso,2025-05-09 13:25:53.299823,35714.28571428572
be grand polanco,7100000.0,100.0,2.0,2.0,19.4390004,-99.1789503,easyaviso,2025-05-09 13:25:53.299823,71000.0
venta de departamento en venta en la colonia cuauhtemoc,4100000.0,73.04,,2.0,19.4275914,-99.1747504,easyaviso,2025-05-09 13:25:53.299823,56133.62541073384
venta de departamento en la colonia cuauhtemoc,4100000.0,73.85,,,19.4275914,-99.1747504,easyaviso,2025-05-09 13:25:53.299823,55517.94177386595
departamento en venta en be  grand,6500000.0,100.0,2.0,2.0,19.4396946,-99.1833554,easyaviso,2025-05-09 13:25:53.299823,65000.0
excelente oportunidad inversionistas rio nazas cuauhtemoc,8000000.0,158.0,2.0,2.0,19.4313622,-99.1691016,easyaviso,2025-05-09 13:25:53.299823,50632.91139240506
increible departamento en san rafael,7180000.0,128.0,3.0,3.0,19.4384703,-99.1684069,easyaviso,2025-05-09 13:25:53.299823,56093.75
departamento con terraza en san rafael,4960000.0,84.0,2.0,3.0,19.4364703,-99.1704069,easyaviso,2025-05-09 13:25:53.299823,59047.619047619046
increible departamento en san rafael,4900000.0,83.0,2.0,2.0,19.4424703,-99.1644069,easyaviso,2025-05-09 13:25:53.299823,59036.14457831325
increible departamento en san rafael,4521100.0,75.0,2.0,2.0,19.4414703,-99.1654069,easyaviso,2025-05-09 13:25:53.299823,60281.333333333336
excelente departamento en preventa  en la colonia san rafael,3050000.0,46.0,,,19.439764,-99.159161,easyaviso,2025-05-09 13:25:53.299823,66304.34782608696
preventa departamentos en la colonia anzures,2249486.0,33.0,,,19.4367689004,-99.1720385387,easyaviso,2025-05-09 13:25:53.299823,68166.24242424243
departamento en renta o venta en reforma  1r1.5b2e  amenidades  120m2,28000000.0,,,,19.4276427,-99.170342,easyaviso,2025-05-09 13:25:53.299823,
venta departamento en san rafael,3350000.0,65.0,,2.0,19.4348262,-99.1611126,easyaviso,2025-05-09 13:25:53.299823,51538.46153846154
departamentos en preventa a una cuadra de reforma,6430000.0,75.0,2.0,2.0,19.4295694,-99.1650953,easyaviso,2025-05-09 13:25:53.299823,85733.33333333333
departamento en venta cuauhtemoc ultimos disponibles,6725000.0,85.0,,,19.4307894117,-99.170150741,easyaviso,2025-05-09 13:25:53.299823,79117.64705882352
departamento en venta cuauhtemoc ultimos disponibles,6400000.0,85.0,2.0,2.0,19.4307894117,-99.170150741,easyaviso,2025-05-09 13:25:53.299823,75294.11764705883
departamento en venta cuauhtemoc ultimos disponibles,7275000.0,85.0,2.0,2.0,19.4307894117,-99.170150741,easyaviso,2025-05-09 13:25:53.299823,85588.23529411765
ph con roof garden privado rio niagara cuauhtemoc.,8500000.0,182.0,2.0,2.0,19.4284546,-99.1709021,easyaviso,2025-05-09 13:25:53.299823,46703.296703296706
departamento a estrenar en venta sobre guadalquivir  cuauhtemoc cdmx,5052570.0,72.99,2.0,2.0,19.4321765,-99.1717473,easyaviso,2025-05-09 13:25:53.299823,69222.77024249898
invierte en un loft para renta en airbnb,1836000.0,25.0,,,19.4078996131,-99.1449033258,easyaviso,2025-05-09 13:25:53.299823,73440.0
departamento en preventa en colonia cuauhtemoc,5842500.0,75.0,2.0,2.0,19.4354119,-99.1682157,easyaviso,2025-05-09 13:25:53.299823,77900.0
departamento en venta con amplios espacios en veronica anzures,5900000.0,157.0,2.0,3.0,19.4335258,-99.1732612,easyaviso,2025-05-09 13:25:53.299823,37579.61783439491
departamento venta col. cuauhtemoc,5400000.0,67.0,2.0,2.0,19.4286428,-99.1718132,easyaviso,2025-05-09 13:25:53.299823,80597.01492537314
departamento en venta col. cuauhtemoc,11000000.0,200.0,2.0,3.0,19.4325978,-99.1636664,easyaviso,2025-05-09 13:25:53.299823,55000.0
venta departamento en col. san rafael cuauhtemoc,3750000.0,65.59,,2.0,19.4070619,-99.1247393,easyaviso,2025-05-09 13:25:53.299823,57173.34959597499
preventa de suites y depas de lujo a 5 min de polanco,2137472.0,33.0,,,19.4347,-99.171,easyaviso,2025-05-09 13:25:53.299823,64771.878787878784
departamento en begrand col. anahuac del. miguel hidalgo,6700000.0,98.0,2.0,2.0,19.4446183,-99.1812529,easyaviso,2025-05-09 13:25:53.299823,68367.3469387755
departamento parques plaza nuevo polanco,9800000.0,122.0,2.0,3.0,19.4394119,-99.1781599,easyaviso,2025-05-09 13:25:53.299823,80327.86885245901
departamento en preventa a una cuadra de reforma rio papaloapan 19201,6566760.0,75.0,2.0,2.0,19.4296229,-99.1653226,easyaviso,2025-05-09 13:25:53.299823,87556.8
departamento en preventa a una cuadra de reforma rio papaloapan 19202,6511680.0,74.5,2.0,2.0,19.4296229,-99.1653226,easyaviso,2025-05-09 13:25:53.299823,87405.10067114094
departamento en rio guadalquivir cuahutemoc  cdmx,6900000.0,75.9,2.0,2.0,19.4292751,-99.1705033,easyaviso,2025-05-09 13:25:53.299823,90909.0909090909
departamento en rio guadalquivir cuahutemoc  cdmx,5052570.0,72.0,2.0,2.0,19.4292751,-99.1705033,easyaviso,2025-05-09 13:25:53.299823,70174.58333333333
departamento en en venta en  torre carso,5850000.0,89.0,,2.0,19.4276061,-99.1608372,easyaviso,2025-05-09 13:25:53.299823,65730.33707865169
departamentos rio guadiana  cuauhtemoc,5300000.0,86.0,2.0,,19.4328109,-99.1607492,easyaviso,2025-05-09 13:25:53.299823,61627.90697674418
departamento en venta en rio danubio cuauhtemoc,4800000.0,84.0,2.0,2.0,19.4300115,-99.1674328,easyaviso,2025-05-09 13:25:53.299823,57142.857142857145
preventa depto en col cuauhtemoc,4750000.0,68.26,,,19.4300507,-99.1721338,easyaviso,2025-05-09 13:25:53.299823,69586.87371813653
departamento en venta colonia cuauhtemoc,5600000.0,70.0,2.0,2.0,19.4306118,-99.1628482,easyaviso,2025-05-09 13:25:53.299823,80000.0
departamento en preventa con excelente ubicacion el la col. san rafael,3687414.0,55.65,2.0,2.0,19.4432445,-99.1591588,easyaviso,2025-05-09 13:25:53.299823,66260.80862533693
venta  departamento ph en colonia cuauhtemoc,10500000.0,177.0,2.0,3.0,19.4312007,-99.1690176,easyaviso,2025-05-09 13:25:53.299823,59322.03389830508
preventa departamento colonia  san rafael alcaldia cuahtemoc,7611240.0,148.0,2.0,3.0,19.4373262,-99.1617888,easyaviso,2025-05-09 13:25:53.299823,51427.2972972973
departamento en miguel hidalgo no pierdas la oportunidad de comprar,681300.0,68.0,2.0,2.0,19.4415231,-99.1746562,easyaviso,2025-05-09 13:25:53.299823,10019.117647058823
departamento en venta en st regis,64320960.0,189.0,2.0,2.0,19.4256427,-99.172342,easyaviso,2025-05-09 13:25:53.299823,340322.5396825397
departamento en preventa rio papaloapan 19 al lado de reforma,6431100.0,75.0,2.0,2.0,19.4296229,-99.1653226,easyaviso,2025-05-09 13:25:53.299823,85748.0
departamento en venta   the ritzcarlton,23389440.0,80.0,,,19.4240425,-99.1757592,easyaviso,2025-05-09 13:25:53.299823,292368.0
cuauhtemocdepartamentoventacdmx,5737100.0,70.03,2.0,2.0,19.4317093,-99.1659514,easyaviso,2025-05-09 13:25:53.299823,81923.46137369699
cuauhtemocdepartamentoventacdmx,5726800.0,70.03,2.0,2.0,19.4317093,-99.1659514,easyaviso,2025-05-09 13:25:53.299823,81776.38155076395
cuauhtemocdepartamento ventacdmx,5623800.0,70.12,2.0,2.0,19.4317093,-99.1659514,easyaviso,2025-05-09 13:25:53.299823,80202.50998288648
departamento en venta en san rafael,5991034.0,108.0,2.0,2.0,19.4373575,-99.1641888,easyaviso,2025-05-09 13:25:53.299823,55472.53703703704
departamento de ritz carlton,18029360.0,60.0,,,19.423797,-99.1756078,easyaviso,2025-05-09 13:25:53.299823,300489.3333333333
vendo amplio departamento en cdmx,4300000.0,159.0,,3.0,19.4347439,-99.1585234,easyaviso,2025-05-09 13:25:53.299823,27044.025157232703
departamento en rio tiber  cuauhtemoc,4350000.0,89.0,2.0,2.0,19.4306406,-99.1695675,easyaviso,2025-05-09 13:25:53.299823,48876.40449438202
preventa de depto en col san rafael,2988808.0,40.0,,,19.4374624,-99.1618411,easyaviso,2025-05-09 13:25:53.299823,74720.2
departamento en venta en serapio rendon 21  colonia san rafael,4890000.0,71.6,,2.0,19.4397643,-99.1591613,easyaviso,2025-05-09 13:25:53.299823,68296.08938547487
departamento en venta rio rhin colonia cuauhtemoc ciudad de mexico.,5900000.0,70.0,2.0,2.0,19.4310044,-99.1650972,easyaviso,2025-05-09 13:25:53.299823,84285.71428571429
departamento cuauhtemoc  reforma,6000000.0,81.32,2.0,2.0,19.4319934212,-99.1654086156,easyaviso,2025-05-09 13:25:53.299823,73782.58730939499
departamentos en venta rio nazas 185,5300000.0,52.6,,,19.4300507,-99.1721338,easyaviso,2025-05-09 13:25:53.299823,100760.45627376426
departamento de st. regis,37033280.0,189.0,2.0,2.0,19.4256427,-99.172342,easyaviso,2025-05-09 13:25:53.299823,195943.28042328043
super depa remodelado y amueblado en plaza grijalva,6400000.0,98.0,2.0,2.0,19.4301322,-99.1691413,easyaviso,2025-05-09 13:25:53.299823,65306.12244897959
departamentos rio papaloapan  cuauhtemoc,6583080.0,75.0,2.0,2.0,19.4295694,-99.1650953,easyaviso,2025-05-09 13:25:53.299823,87774.4
nuevo departamento en venta col. cuauhtemoc,5975000.0,70.0,2.0,2.0,19.4310044,-99.1650972,easyaviso,2025-05-09 13:25:53.299823,85357.14285714286
edificio  col. san rafael cuauhtemoc cuidad de mexico.,110000000.0,400.0,5.0,10.0,19.4415975,-99.1654649,easyaviso,2025-05-09 13:25:53.299823,275000.0
desarrollo en san rafael,5514600.0,97.0,2.0,2.0,19.4373262,-99.1617888,easyaviso,2025-05-09 13:25:53.299823,56851.54639175258
departamentos en venta en col. san rafael. cuauhtemoc. cdmx.,5380000.0,107.0,2.0,2.0,19.4373575,-99.1641888,easyaviso,2025-05-09 13:25:53.299823,50280.3738317757
venta departamento en colonia cuauhtemoc,4950000.0,90.0,2.0,2.0,19.4301322,-99.1691413,easyaviso,2025-05-09 13:25:53.299823,55000.0
departamento en venta en colonia cuauhtemoc,6700000.0,90.0,2.0,2.0,19.4291907,-99.1702334,easyaviso,2025-05-09 13:25:53.299823,74444.44444444444
departamento en venta en chapultepec uno r509,19668043.6576,73.32,,,19.4240913133,-99.1758102208,easyaviso,2025-05-09 13:25:53.299823,268249.36794326245
departamento de 2 recamaras en venta en chapultepec uno r509,30624164.1248,112.29,2.0,2.0,19.423797,-99.1756078,easyaviso,2025-05-09 13:25:53.299823,272723.8767904533
departamento en venta en avenida paseo de la reforma 439 cuauhtemoc cdmx,31696000.0,183.0,3.0,2.0,19.4254105,-99.1721848,easyaviso,2025-05-09 13:25:53.299823,173202.18579234972
departamento en muy buena ubicacion atras de la torre mayor,8700000.0,190.0,2.0,2.0,19.4262236,-99.1733693,easyaviso,2025-05-09 13:25:53.299823,45789.47368421053
departamento venta cuauhtemoc rio elba rdv599485,6690000.0,116.5,,2.0,19.4260089,-99.1755645,easyaviso,2025-05-09 13:25:53.299823,57424.892703862664
departamento venta en 2 niveles cuauhtemoc rio elba rdv599491,8390000.0,163.5,2.0,3.0,19.4260089,-99.1755645,easyaviso,2025-05-09 13:25:53.299823,51314.98470948012
departamento venta cuauhtemoc rio elba rdv599479,4940000.0,86.5,,2.0,19.4260089,-99.1755645,easyaviso,2025-05-09 13:25:53.299823,57109.826589595374
depa venta  nuevo precio increible,8850000.0,85.0,2.0,2.0,19.4301322,-99.1691413,easyaviso,2025-05-09 13:25:53.299823,104117.64705882352
hermoso desarrollo  en rio rhin entre reforma y parque sullivan,6432000.0,92.0,2.0,2.0,19.4317498,-99.1652508,easyaviso,2025-05-09 13:25:53.299823,69913.04347826086
hermoso desarrollo  en rio rhin entre reforma y parque sullivan,5465000.0,77.0,2.0,2.0,19.4317498,-99.1652508,easyaviso,2025-05-09 13:25:53.299823,70974.02597402598
departamento venta 2 terrazas cuauhtemoc,6990000.0,111.0,2.0,2.0,19.4319434,-99.1678492,easyaviso,2025-05-09 13:25:53.299823,62972.97297297297
increible departamento en venta polanco,4350500.0,80.0,2.0,2.0,19.4435865,-99.1935125,easyaviso,2025-05-09 13:25:53.299823,54381.25
departamento venta rosas moreno san rafael,4903253.0,111.0,2.0,2.0,19.4371305,-99.1620879,easyaviso,2025-05-09 13:25:53.299823,44173.45045045045
cuauhtemoc departamento en venta,5052570.0,72.99,2.0,2.0,19.4321765,-99.1717473,easyaviso,2025-05-09 13:25:53.299823,69222.77024249898
venta departamento gabino barreda san rafael,6080452.0,113.0,2.0,2.0,19.4389929,-99.1635993,easyaviso,2025-05-09 13:25:53.299823,53809.30973451328
venta departamentos en la san rafael,5252000.0,112.0,2.0,2.0,19.4383262,-99.1607888,easyaviso,2025-05-09 13:25:53.299823,46892.857142857145
departamento en venta en paseo de reforma,18817701.0752,65.18,,,19.4273694,-99.1684647,easyaviso,2025-05-09 13:25:53.299823,288703.6065541577
departamento en venta en paseo de reforma,31504211.296,117.03,2.0,,19.4273694,-99.1684647,easyaviso,2025-05-09 13:25:53.299823,269197.7381526104
departamento en venta en paseo de reforma,19133049.2,70.68,,,19.4273694,-99.1684647,easyaviso,2025-05-09 13:25:53.299823,270699.62082625914
departamento en venta en paseo de reforma,30624164.1248,112.29,2.0,,19.4273694,-99.1684647,easyaviso,2025-05-09 13:25:53.299823,272723.8767904533
departamento en venta en paseo de reforma,19668043.6576,73.32,,,19.4273694,-99.1684647,easyaviso,2025-05-09 13:25:53.299823,268249.36794326245
departamento en venta en paseo de reforma,30674003.1232,113.01,2.0,,19.4273694,-99.1684647,easyaviso,2025-05-09 13:25:53.299823,271427.3349544288
departamento en venta en paseo de reforma,19998965.251199998,74.61,,,19.4273694,-99.1684647,easyaviso,2025-05-09 13:25:53.299823,268046.7129232006
cuauhtemoc departamento con terraza en venta,6317500.0,76.0,2.0,2.0,19.4340024,-99.1698862,easyaviso,2025-05-09 13:25:53.299823,83125.0
vivir en la  san rafael  es bellisimo depas  desde  2506000,2981000.0,51.94,2.0,2.0,19.4373201,-99.1617645,easyaviso,2025-05-09 13:25:53.299823,57393.145937620335
departamento en rio rhin,5900000.0,84.0,2.0,2.0,19.4317498,-99.1652508,easyaviso,2025-05-09 13:25:53.299823,70238.09523809524
exclusiva preventa de departamentos en san rafael,2185575.0,37.87,,,19.4381826,-99.1626277,easyaviso,2025-05-09 13:25:53.299823,57712.56931608133
departamento en venta en cuauhtemoc cerca de paseo de la reforma,5000000.0,75.0,2.0,2.0,19.4320969,-99.1629112,easyaviso,2025-05-09 13:25:53.299823,66666.66666666667
departamento en venta en be grand reforma.,8990000.0,97.0,2.0,2.0,19.434631,-99.1535239,easyaviso,2025-05-09 13:25:53.299823,92680.41237113402
departamento en venta colonia tlaxpana,2800000.0,55.0,,2.0,19.4415302,-99.1698747,easyaviso,2025-05-09 13:25:53.299823,50909.09090909091
departamentos en venta gabino barreda,5116800.0,110.0,2.0,2.0,19.4373575,-99.1641888,easyaviso,2025-05-09 13:25:53.299823,46516.36363636364
departamento venta col. san rafael,2300000.0,30.66,,,19.4373262,-99.1617888,easyaviso,2025-05-09 13:25:53.299823,75016.30789302022
departamento en venta  en col san rafael de 95 m2,7129000.0,95.0,2.0,2.0,19.4364755,-99.1583026,easyaviso,2025-05-09 13:25:53.299823,75042.1052631579
venta de departamento en la colonia anahuac miguel hidalgo,3300000.0,70.0,,2.0,19.4432475,-99.1709172,easyaviso,2025-05-09 13:25:53.299823,47142.857142857145
cuauhtemoc departamento en venta cuauhtemoc cdmx,5465000.0,71.0,2.0,2.0,19.4287498,-99.1682508,easyaviso,2025-05-09 13:25:53.299823,76971.8309859155
cuauhtemoc departamento en venta cuauhtemoc cdmx,6220000.0,89.0,2.0,2.0,19.4317498,-99.1652508,easyaviso,2025-05-09 13:25:53.299823,69887.6404494382
