oferta,precio,mts,bathrooms,recamaras,lat,lon,fuente,fecha_consulta,precio_m2
departamento en venta en la cuauhtemoc  rio nilo,5600000.0,90.0,2.0,2.0,19.4306355,-99.1727677,easyaviso,2025-05-09 13:25:53.299823,62222.22222222222
se vende departamento para remodelacion,2000000.0,54.0,,,19.4260563,-99.1746597,easyaviso,2025-05-09 13:25:53.299823,37037.03703703704
lindo departamento  5 recamaras  veronica anzures,8900000.0,186.45,3.0,5.0,19.4358238,-99.1738385,easyaviso,2025-05-09 13:25:53.299823,47733.97693751677
departamento en venta 2 recamaras colonia cuauhtemoc cdmx,5100000.0,77.4,2.0,2.0,19.4298408,-99.164915,easyaviso,2025-05-09 13:25:53.299823,65891.47286821705
rio grijalva,7142500.0,70.1,2.0,2.0,19.4335862,-99.1698593,easyaviso,2025-05-09 13:25:53.299823,101890.1569186876
departamento en venta en colonia cuauhtemoc 4940000,4940000.0,81.0,,2.0,19.4260312701,-99.1754196833,easyaviso,2025-05-09 13:25:53.299823,60987.654320987655
departamento en venta en colonia cuauhtemoc 6690000,6690000.0,111.0,,2.0,19.4260515063,-99.1754840563,easyaviso,2025-05-09 13:25:53.299823,60270.27027027027
departamento en la san rafael cuauhtemoc,4200000.0,129.0,,2.0,19.4381862821,-99.1626054796,easyaviso,2025-05-09 13:25:53.299823,32558.13953488372
departamento en venta en anzures,10115000.0,123.0,2.0,2.0,19.4337133,-99.1727421,easyaviso,2025-05-09 13:25:53.299823,82235.77235772357
unica oportunidad de inversion   en be grand polanco,10900000.0,160.0,3.0,3.0,19.4401566,-99.1829788,easyaviso,2025-05-09 13:25:53.299823,68125.0
moderno loft con terraza cerca del angel de la independencia,7500000.0,134.0,,,19.431741,-99.1652276,easyaviso,2025-05-09 13:25:53.299823,55970.149253731346
venta departamento amoblado a un paso de reforma. col cuahutemoc,5100000.0,93.0,,,19.4253891,-99.1743424,easyaviso,2025-05-09 13:25:53.299823,54838.709677419356
se vende penthouse en rio danubio cuauhtemoc.,8400000.0,180.0,,2.0,19.430845625,-99.1680309683,easyaviso,2025-05-09 13:25:53.299823,46666.666666666664
preventa departamentos desarrollo maxica insurgentes,2400000.0,28.0,,,19.4397772,-99.155771,easyaviso,2025-05-09 13:25:53.299823,85714.28571428571
depto en pre venta guadalquivir colonia cuauhtemoc  cdmx,6000000.0,70.1,2.0,2.0,19.4278019086,-99.17275306,easyaviso,2025-05-09 13:25:53.299823,85592.0114122682
venta departamento hares  av. ejercito nacional js,7350000.0,100.93,2.0,2.0,19.4363338521,-99.1794197945,easyaviso,2025-05-09 13:25:53.299823,72822.74843951254
departamento en venta en el corazon de la colonia san rafael,2900000.0,55.0,,2.0,19.4407762,-99.1600762,easyaviso,2025-05-09 13:25:53.299823,52727.27272727273
venta departamento ph en cuauhtemoc,11000000.0,170.0,2.0,2.0,19.4286386,-99.1718367,easyaviso,2025-05-09 13:25:53.299823,64705.882352941175
venta departamentos san rafael altamirano 39,3241695.0,59.0,,2.0,19.4402445,-99.1621588,easyaviso,2025-05-09 13:25:53.299823,54943.983050847455
venta departamento en veronica anzures,4550000.0,60.0,2.0,,19.4381594986,-99.1728272601,easyaviso,2025-05-09 13:25:53.299823,75833.33333333333
departamento en venta en san rafael cuauhtemoc.,5865146.0,110.0,2.0,2.0,19.4389929,-99.1635993,easyaviso,2025-05-09 13:25:53.299823,53319.509090909094
departamento en venta ritz carlton reforma,17540130.88,55.0,,,19.4263694,-99.1694647,easyaviso,2025-05-09 13:25:53.299823,318911.47054545453
oportunidad unica  en la cuauhtemoc b,4700000.0,95.0,2.0,2.0,19.4310585,-99.1726639,easyaviso,2025-05-09 13:25:53.299823,49473.68421052631
departamento en venta reforma cuauhtemoc   fm273,7000000.0,77.0,,,19.4301322,-99.1691413,easyaviso,2025-05-09 13:25:53.299823,90909.09090909091
venta de departamento en cuauhtemoc zp141,5999999.0,100.0,2.0,3.0,19.4275011049,-99.169286684,easyaviso,2025-05-09 13:25:53.299823,59999.99
departamento en venta,5400000.0,67.0,2.0,2.0,19.4306451,-99.172753,easyaviso,2025-05-09 13:25:53.299823,80597.01492537314
departamento en venta all vista col. san rafael,3645000.0,61.0,2.0,2.0,19.4395191,-99.1673955,easyaviso,2025-05-09 13:25:53.299823,59754.098360655735
departamento en venta en san rafael,3097938.0,39.0,,,19.4378073,-99.1615231,easyaviso,2025-05-09 13:25:53.299823,79434.30769230769
departamento en venta  paseo de la reforma,17500000.0,200.0,2.0,3.0,19.4269334094,-99.1676600366,easyaviso,2025-05-09 13:25:53.299823,87500.0
depa balcon san rafael venta,7100000.0,95.0,2.0,2.0,19.4364755,-99.1583026,easyaviso,2025-05-09 13:25:53.299823,74736.84210526316
vendo departamento en san rafael,4450000.0,115.0,2.0,2.0,19.4375163,-99.163582,easyaviso,2025-05-09 13:25:53.299823,38695.65217391304
departamento en venta insurgentes,8801947.0,97.0,2.0,2.0,19.4324741,-99.1589887,easyaviso,2025-05-09 13:25:53.299823,90741.72164948453
loft en venta en insurgentes,3257512.0,32.31,,,19.4324741,-99.1589887,easyaviso,2025-05-09 13:25:53.299823,100820.55091303002
tu hogar en cuauhtemoc,5500000.0,70.0,2.0,2.0,19.4278779,-99.1730229,easyaviso,2025-05-09 13:25:53.299823,78571.42857142857
tu hogar en la cuauhtemoc,5000000.0,68.0,2.0,2.0,19.4301322,-99.1691413,easyaviso,2025-05-09 13:25:53.299823,73529.41176470589
departamento en venta en rio elba a unos pasos del angel de la independencia,4700000.0,100.0,,2.0,19.4254137,-99.1749721,easyaviso,2025-05-09 13:25:53.299823,47000.0
departamento entrega inmediata en san rafael en venta,5866000.0,110.0,2.0,2.0,19.4373442,-99.1642038,easyaviso,2025-05-09 13:25:53.299823,53327.27272727273
departamento entrega inmediata en san rafael en venta,6080500.0,97.0,2.0,2.0,19.4373442,-99.1642038,easyaviso,2025-05-09 13:25:53.299823,62685.56701030928
departamento de lujo  oportunidad,6400000.0,75.0,2.0,2.0,19.432758,-99.1697432,easyaviso,2025-05-09 13:25:53.299823,85333.33333333333
departamento en renta en parques polanco amueblado lindo,4250000.0,56.0,,,19.440953,-99.18503,easyaviso,2025-05-09 13:25:53.299823,75892.85714285714
ph en lazaro cardenas en venta,3520000.0,92.69,2.0,2.0,19.4300874,-99.1416877,easyaviso,2025-05-09 13:25:53.299823,37976.04919624555
junto a  polanco  departamento   en venta,2950000.0,55.0,,2.0,19.4496769,-99.1909152,easyaviso,2025-05-09 13:25:53.299823,53636.36363636364
departamento en venta en la colonia juarez,3490000.0,63.0,2.0,2.0,19.4286386,-99.1718367,easyaviso,2025-05-09 13:25:53.299823,55396.8253968254
ph para estrenar con roof privado,8350000.0,143.0,2.0,2.0,19.4325050035,-99.169788212,easyaviso,2025-05-09 13:25:53.299823,58391.60839160839
para estrenar en cuauhtemoc,5750000.0,77.0,2.0,2.0,19.4325050035,-99.169788212,easyaviso,2025-05-09 13:25:53.299823,74675.32467532468
penthouse en col. roma,12200000.0,200.75,2.0,2.0,19.4286386,-99.1718367,easyaviso,2025-05-09 13:25:53.299823,60772.10460772105
deoto en venta en col. tlaxpana a 2 cuadras de metro normal,2300000.0,57.0,,2.0,19.442490161,-99.1701361018,easyaviso,2025-05-09 13:25:53.299823,40350.87719298246
departamento en be grand alto polanco venta,6200000.0,88.65,2.0,2.0,19.4426183,-99.1832529,easyaviso,2025-05-09 13:25:53.299823,69937.95826283135
napoles i cuauhtemoc cuauhtemoc cdmx,3364858.0,26.0,,,19.4262416,-99.1612501,easyaviso,2025-05-09 13:25:53.299823,129417.61538461539
en venta magnifico departamento muy cerca del angel de la independencia,6200000.0,108.58,2.0,2.0,19.4301764,-99.1687306,easyaviso,2025-05-09 13:25:53.299823,57100.755203536566
departamento a 3 cuadras de reforma,6120000.0,76.0,,2.0,19.4320759,-99.1677503,easyaviso,2025-05-09 13:25:53.299823,80526.31578947368
departamento en venta,2250000.0,58.0,2.0,2.0,19.441191,-99.173546,easyaviso,2025-05-09 13:25:53.299823,38793.10344827586
departamento en venta renacimiento cuauhtemoc2 recamaras 77m2,6000000.0,77.0,2.0,2.0,19.431691,-99.16134,easyaviso,2025-05-09 13:25:53.299823,77922.07792207792
preventa de departamentos en rio papaloapan  colonia cuauhtemoc,6431000.0,65.32,2.0,2.0,19.4295028,-99.1654324,easyaviso,2025-05-09 13:25:53.299823,98453.76607470913
bonito departamento,1860000.0,52.0,,2.0,19.4545879,-99.1519871,easyaviso,2025-05-09 13:25:53.299823,35769.230769230766
departamento en venta en rio sena,5500000.0,90.0,2.0,2.0,19.4326769,-99.1674462,easyaviso,2025-05-09 13:25:53.299823,61111.11111111111
departamento en rio tiber,5975000.0,86.0,2.0,2.0,19.4306406,-99.1695675,easyaviso,2025-05-09 13:25:53.299823,69476.74418604652
departamento en ventalaguna del carmen anahuac i secc miguel hidalgo,2054000.0,56.0,,2.0,19.4483422623,-99.1747407941,easyaviso,2025-05-09 13:25:53.299823,36678.57142857143
miguel e. schultz  san rafael  cuauhtemoc  cdmx.,8268000.0,105.0,2.0,2.0,19.4409259,-99.1596716,easyaviso,2025-05-09 13:25:53.299823,78742.85714285714
miguel e. schultz  san rafael  cuauhtemoc  cdmx.,7956000.0,100.0,,2.0,19.4409259,-99.1596716,easyaviso,2025-05-09 13:25:53.299823,79560.0
renta departamento  be grand alto polanco  mariano escobedo  anahuac,6500000.0,98.0,2.0,2.0,19.4441731,-99.1829066,easyaviso,2025-05-09 13:25:53.299823,66326.5306122449
renta departamento be grand reforma,10000000.0,85.0,2.0,2.0,19.434631,-99.1535239,easyaviso,2025-05-09 13:25:53.299823,117647.05882352941
depa en parques polanco 2 pisos en venta y renta,7350000.0,120.0,2.0,2.0,19.4404402,-99.1851841,easyaviso,2025-05-09 13:25:53.299823,61250.0
departamento en cuauhtemoc,3500000.0,77.0,,,19.4318092,-99.1670161,easyaviso,2025-05-09 13:25:53.299823,45454.545454545456
departamento en miguel hidalgo,1870000.0,60.0,,2.0,19.4452718,-99.169271,easyaviso,2025-05-09 13:25:53.299823,31166.666666666668
se vende departamento  en cdmx col san  rafael,2157000.0,28.76,,,19.3375524,-99.0476594,easyaviso,2025-05-09 13:25:53.299823,75000.0
venta garden house cuauhtemoc con balcon exterior y terraza interior,6250000.0,91.85,2.0,2.0,19.4331322,-99.1661413,easyaviso,2025-05-09 13:25:53.299823,68045.72672836146
pent house con roof garden privado 133.6m2  arq. artigas,6500000.0,133.6,,,19.4285992,-99.164416,easyaviso,2025-05-09 13:25:53.299823,48652.694610778446
vive en el corazon de la san rafael,2939821.92,40.0,,,19.3357582,-99.0478941,easyaviso,2025-05-09 13:25:53.299823,73495.548
departamentos en venta col. san rafael cuauhtemoc,5865146.0,110.0,2.0,2.0,19.4397066,-99.1614544,easyaviso,2025-05-09 13:25:53.299823,53319.509090909094
excelente oportunidad preventa departamentos  col cuauhtemoc,6500000.0,75.0,2.0,2.0,19.4311322,-99.1681413,easyaviso,2025-05-09 13:25:53.299823,86666.66666666667
departamento con roof garden privado y balcon en san rafael,5865146.0,110.0,2.0,2.0,19.4364045,-99.1650894,easyaviso,2025-05-09 13:25:53.299823,53319.509090909094
departamento en calzada manuel villalongin 200,5795400.0,96.0,,2.0,19.4335258,-99.1657307,easyaviso,2025-05-09 13:25:53.299823,60368.75
departamento en venta colonia cuauhtemoc,3321556.0,32.0,,,19.4269984,-99.1701674,easyaviso,2025-05-09 13:25:53.299823,103798.625
departamento en preventa en rio rhin cuauhtemoc,4900100.0,68.0,2.0,2.0,19.4317498,-99.1652508,easyaviso,2025-05-09 13:25:53.299823,72060.29411764706
departamento en preventa en rio rhin cuauhtemoc,6485000.0,96.0,2.0,2.0,19.4317498,-99.1652508,easyaviso,2025-05-09 13:25:53.299823,67552.08333333333
departamento en venta en distum veronica anzures,5400050.0,83.0,2.0,2.0,19.4376516,-99.1724718,easyaviso,2025-05-09 13:25:53.299823,65060.843373493975
departamento en cuauhtemoc,3490000.0,63.0,,2.0,19.4306386,-99.1698367,easyaviso,2025-05-09 13:25:53.299823,55396.8253968254
departamento en venta ritz carlton,32000000.0,117.0,2.0,2.0,19.423797,-99.1756078,easyaviso,2025-05-09 13:25:53.299823,273504.2735042735
departamento en venta o renta en ritz carlton residences reforma cuauhtemoc,15000000.0,63.0,,,19.4240425,-99.1757592,easyaviso,2025-05-09 13:25:53.299823,238095.2380952381
departamento en venta  en reforma 222,32000000.0,290.0,2.0,2.0,19.4255584,-99.1711814,easyaviso,2025-05-09 13:25:53.299823,110344.8275862069
departamento en venta con roof privado en san rafael cuauhtemoc.,6050646.0,109.0,2.0,2.0,19.4389929,-99.1635993,easyaviso,2025-05-09 13:25:53.299823,55510.51376146789
departamento en venta en cuauhtemoc ultimo precio,4700000.0,85.0,,2.0,19.4295694,-99.1650953,easyaviso,2025-05-09 13:25:53.299823,55294.117647058825
departamento en venta en san rafael,3650000.0,47.0,,,19.4378062,-99.1644967,easyaviso,2025-05-09 13:25:53.299823,77659.5744680851
proyecto de usos mixtos distingue tu vida,2337104.0,30.0,,,19.4376516,-99.1724718,easyaviso,2025-05-09 13:25:53.299823,77903.46666666666
venta de departamento en colonia cuauhtemoc,5990000.0,79.6,,,19.4332175,-99.1711272,easyaviso,2025-05-09 13:25:53.299823,75251.25628140704
preventa departamento de 2 recamaras con balcon,6518338.0,75.0,2.0,2.0,19.4301322,-99.1691413,easyaviso,2025-05-09 13:25:53.299823,86911.17333333334
venta  de ph de 2 recamaras en col. cuauhtemoc solo para inversionistas,7900000.0,158.0,2.0,2.0,19.4301322,-99.1691413,easyaviso,2025-05-09 13:25:53.299823,50000.0
venta ph con roof garden y balcon a estrenar col. cuauhtemoc,6500000.0,134.0,,,19.4316439,-99.1608004,easyaviso,2025-05-09 13:25:53.299823,48507.46268656717
carlos juan finlay cuauhtemoc,6500000.0,83.0,2.0,,19.3880779,-99.1012847,easyaviso,2025-05-09 13:25:53.299823,78313.2530120482
amplio ph en venta a estrenar con roof garden privado colonia cuauhtemoc,8390000.0,163.0,2.0,3.0,19.4255513,-99.1751531,easyaviso,2025-05-09 13:25:53.299823,51472.39263803681
hermosos departamentos a estrenar en venta en colonia cuauhtemoc,5350000.0,85.0,,2.0,19.4255513,-99.1751531,easyaviso,2025-05-09 13:25:53.299823,62941.17647058824
departamento exterior con terraza,8500000.0,150.0,2.0,3.0,19.4332329,-99.1660573,easyaviso,2025-05-09 13:25:53.299823,56666.666666666664
colonia cuauhtemoc departamento en venta,7612752.0,80.0,2.0,2.0,19.4269984,-99.1701674,easyaviso,2025-05-09 13:25:53.299823,95159.4
departamento en venta colonia cuauhtemoc,5268330.0,58.0,,,19.4269984,-99.1701674,easyaviso,2025-05-09 13:25:53.299823,90833.27586206897
departamento en lazaro cardenas en venta,2807000.0,62.69,2.0,2.0,19.4300874,-99.1416877,easyaviso,2025-05-09 13:25:53.299823,44775.881320784814
departamento en lazaro cardenas en venta,2234000.0,53.0,,,19.4300874,-99.1416877,easyaviso,2025-05-09 13:25:53.299823,42150.943396226416
departamento en cuauhtemoc,1910000.0,42.0,,2.0,19.4346971,-99.1689567,easyaviso,2025-05-09 13:25:53.299823,45476.19047619047
departamento venta anzures 60m2 depto 1207,4100000.0,60.0,,,19.4408119,-99.1694644,easyaviso,2025-05-09 13:25:53.299823,68333.33333333333
departamento en venta tres lagos anahuac miguel hidalgo,5800000.0,80.0,2.0,2.0,19.4390071393,-99.1806029702,easyaviso,2025-05-09 13:25:53.299823,72500.0
departamento be grand polanco alcaldia miguel hidalgo,9480000.0,104.8,2.0,3.0,19.4400604,-99.1857682,easyaviso,2025-05-09 13:25:53.299823,90458.01526717558
departamento en la calle rio ebro para modernizar,2700000.0,54.0,,2.0,19.432648,-99.1713434,easyaviso,2025-05-09 13:25:53.299823,50000.0
venta de departamento en renacimiento cuauhtemoc kf284,3000000.0,81.0,,,19.5491502,-99.1367205,easyaviso,2025-05-09 13:25:53.299823,37037.03703703704
departamento en venta en parques plaza nuevo polancolago alberto 442 anahuac,3900000.0,52.0,,,19.4384194,-99.1783942,easyaviso,2025-05-09 13:25:53.299823,75000.0
departamento en venta en colonia cuauhtemoc 8390000,8390000.0,138.5,2.0,3.0,19.4259631662,-99.1754508104,easyaviso,2025-05-09 13:25:53.299823,60577.61732851985
rio papaloapan i cuauhtemoc cuauhtemoc cdmx,6431100.0,63.74,2.0,2.0,19.4325028,-99.1624324,easyaviso,2025-05-09 13:25:53.299823,100895.82679636021
departamento en venta en rio elba 13 cuauhtemoc cdmx,6690000.0,116.5,2.0,2.0,19.426062,-99.1755442,easyaviso,2025-05-09 13:25:53.299823,57424.892703862664
departamento en venta en  rio elba 13,4940000.0,81.5,,2.0,19.426062,-99.1755442,easyaviso,2025-05-09 13:25:53.299823,60613.496932515336
departamento en venta en rio elba 13 cuauhtemoc cdmx,8390000.0,138.5,2.0,3.0,19.426062,-99.1755442,easyaviso,2025-05-09 13:25:53.299823,60577.61732851985
penthouse interior en preventa roof propio jun 2026 anahuac miguel hidalgo,7500000.0,206.0,3.0,2.0,19.4446395,-99.1762434,easyaviso,2025-05-09 13:25:53.299823,36407.76699029126
venta departamento en residencial distum anzures,4550000.0,60.0,2.0,,19.4376516,-99.1724718,easyaviso,2025-05-09 13:25:53.299823,75833.33333333333
venta departamento san rafael,9600000.0,256.0,2.0,3.0,19.4364755,-99.1583026,easyaviso,2025-05-09 13:25:53.299823,37500.0
venta de hermoso departamento con la mejor ubicacion,7129070.0,203.0,2.0,2.0,19.4361447,-99.1581342,easyaviso,2025-05-09 13:25:53.299823,35118.57142857143
hermoso apartamento en venta,5515800.0,95.1,2.0,2.0,19.4361447,-99.1581342,easyaviso,2025-05-09 13:25:53.299823,58000.0
departamento amueblado en be grand alto polanco  linda vista,4750000.0,60.0,,,19.4395976,-99.1825289,easyaviso,2025-05-09 13:25:53.299823,79166.66666666667
departamento venta cuauhtemoc paseo de la reforma,4803000.0,71.0,,,19.4271915,-99.1726439,easyaviso,2025-05-09 13:25:53.299823,67647.88732394367
penthouse exterior en preventa roof propio jun 2026 anahuac miguel hidalgo,6575000.0,171.0,3.0,2.0,19.4446395,-99.1762434,easyaviso,2025-05-09 13:25:53.299823,38450.29239766082
departamento venta cuauhtemoc paseo de la reforma,4755000.0,71.0,,,19.4271915,-99.1726439,easyaviso,2025-05-09 13:25:53.299823,66971.8309859155
departamento interior en preventa jun 2026 anahuac miguel hidalgo,5550000.0,121.0,3.0,2.0,19.4446395,-99.1762434,easyaviso,2025-05-09 13:25:53.299823,45867.76859504132
departamento exterior en preventa jun 2026 anahuac miguel hidalgo.,5675000.0,125.0,3.0,2.0,19.4446395,-99.1762434,easyaviso,2025-05-09 13:25:53.299823,45400.0
rio gudalquivir 31 departamento en preventa 2 recamaras desde 98.05m2,6942835.0,,,2.0,19.4306645,-99.1713662,easyaviso,2025-05-09 13:25:53.299823,
departamento  en venta tres lagos nvo. polanco,5200000.0,100.0,2.0,3.0,19.4410111,-99.1795604,easyaviso,2025-05-09 13:25:53.299823,52000.0
rio grijalva 35 departamento en preventa 2 recamaras con balcon desde 75.7m2,5842500.0,,2.0,2.0,19.4339137,-99.170432,easyaviso,2025-05-09 13:25:53.299823,
departamento en venta y renta en paseo de la reforma,6950000.0,140.0,2.0,2.0,19.4277893,-99.171524,easyaviso,2025-05-09 13:25:53.299823,49642.857142857145
departamento en venta en cuauhtemoc,5400000.0,80.0,2.0,2.0,19.4295319,-99.1706944,easyaviso,2025-05-09 13:25:53.299823,67500.0
deparatamento en venta en cuauhtemoc rio panuco,5950000.0,70.12,2.0,2.0,19.4316992,-99.1659505,easyaviso,2025-05-09 13:25:53.299823,84854.53508271535
departamento interior en preventa junio 2026,6325000.0,134.0,3.0,3.0,19.4446395,-99.1762434,easyaviso,2025-05-09 13:25:53.299823,47201.49253731343
venta de pent house col. cuauhtemoc,8350000.0,143.7,2.0,2.0,19.4321322,-99.1671413,easyaviso,2025-05-09 13:25:53.299823,58107.16771050801
departamento en venta amueblado y equipado con balcon edificio art deco 55m2,4500000.0,55.0,,,19.4270948,-99.1751115,easyaviso,2025-05-09 13:25:53.299823,81818.18181818182
venta departamento para airbnbcol. cuauhtemoc,6500000.0,92.0,2.0,2.0,19.4286386,-99.1718367,easyaviso,2025-05-09 13:25:53.299823,70652.17391304347
departamento en rio amazonas a una calle de paseo de la reforma,2499000.0,,,,19.4314584724,-99.1637645158,easyaviso,2025-05-09 13:25:53.299823,
departamento en preventa rio de la plata cuauhtemoc,6417476.37,75.19,2.0,2.0,19.4265146,-99.1739038,easyaviso,2025-05-09 13:25:53.299823,85350.13126745578
venta departamento de lujocol. cuauhtemoc,5700000.0,77.0,2.0,2.0,19.4286386,-99.1718367,easyaviso,2025-05-09 13:25:53.299823,74025.97402597402
departamento en venta rio balsas col cuauhtemoc,3990000.0,112.0,,2.0,19.4319202,-99.1714858,easyaviso,2025-05-09 13:25:53.299823,35625.0
rio de la plata i cuauhtemoc cuauhtemoc cdmx,6417477.0,72.7,2.0,2.0,19.4256007,-99.1748776,easyaviso,2025-05-09 13:25:53.299823,88273.41127922971
rio lerma i cuauhtemoc cuauhtemoc cdmx,3390000.0,37.4,,,19.427616,-99.1723477,easyaviso,2025-05-09 13:25:53.299823,90641.71122994652
rio rhin i cuauhtemoc cuauhtemoc cdmx,4899000.0,65.43,2.0,2.0,19.4343378,-99.1653083,easyaviso,2025-05-09 13:25:53.299823,74873.91104997706
rio guadalquivir iv cuauhtemoc cuauhtemoc cdmx,9991800.0,100.74,2.0,2.0,19.4314631042,-99.1672767738,easyaviso,2025-05-09 13:25:53.299823,99184.03811792734
av. paseo de la reforma i cuauhtemoc cuauhtemoc cdmx,16619717.4336,57.96,,,19.4272600277,-99.1727484738,easyaviso,2025-05-09 13:25:53.299823,286744.6072049689
precioso ph de lujo en venta,7950000.0,150.0,3.0,4.0,19.436516,-99.1739857,easyaviso,2025-05-09 13:25:53.299823,53000.0
entrega inmediata en col. tlaxpana miguel hidalgo,1590000.0,44.5,,2.0,19.4382017,-99.171044,easyaviso,2025-05-09 13:25:53.299823,35730.33707865168
descubre tu proximo hogar en rio ussuri cuauhtemoc,3950000.0,83.9,,2.0,19.4322826,-99.1720224,easyaviso,2025-05-09 13:25:53.299823,47079.85697258641
pent house en col cuauhtemoc 6500000,6500000.0,90.0,,,19.4315141,-99.1624641,easyaviso,2025-05-09 13:25:53.299823,72222.22222222222
en venta departamento en 3 lagos mayran,5800000.0,83.0,2.0,2.0,19.4410071393,-99.1786029702,easyaviso,2025-05-09 13:25:53.299823,69879.51807228915
venta de departamento en col. anahuac,3300000.0,75.0,2.0,2.0,19.4397310272,-99.1778272534,easyaviso,2025-05-09 13:25:53.299823,44000.0
hermosos departamentos en miguel hidalgo veronica anzures desde 2.7m,4100000.0,60.0,,,19.4376516,-99.1724718,easyaviso,2025-05-09 13:25:53.299823,68333.33333333333
venta de departamento en cuauhtemoc cuauhtemoc rio guadalquivir 81.,9991800.0,100.74,2.0,2.0,19.428275,-99.1701372,easyaviso,2025-05-09 13:25:53.299823,99184.03811792734
departamento en excelente ubicacion en la veronica anzures sobre ejercito nacion,4550000.0,131.0,2.0,3.0,19.4346034,-99.1760401,easyaviso,2025-05-09 13:25:53.299823,34732.82442748092
venta departamento 3 recamaras be grand alto polanco,15500000.0,240.0,2.0,3.0,19.4415856958,-99.181879973,easyaviso,2025-05-09 13:25:53.299823,64583.333333333336
departamento en venta con uso habitacional y comercial  rio panuco colonia cua,5800000.0,147.0,2.0,3.0,19.4298059,-99.169518,easyaviso,2025-05-09 13:25:53.299823,39455.78231292517
departamento tipo estudio en venta  colonia cuauhtemoc calle rio balsas,2750000.0,48.0,,,19.4324154,-99.169806,easyaviso,2025-05-09 13:25:53.299823,57291.666666666664
departamento en venta en st regis,19900000.0,120.0,,,19.4252897,-99.17226,easyaviso,2025-05-09 13:25:53.299823,165833.33333333334
departamento en venta cuauhtemoc ciudad de mexico,2489308.0,34.0,,,19.4402445,-99.1621588,easyaviso,2025-05-09 13:25:53.299823,73214.94117647059
departamento en venta en reforma cuauhtemoc. le590,8400000.0,180.0,,2.0,19.3191980044,-99.2447106024,easyaviso,2025-05-09 13:25:53.299823,46666.666666666664
departamento en preventa rio nazas cuauhtemoc entrega inmediata,6850000.0,105.2,2.0,2.0,19.431362,-99.169102,easyaviso,2025-05-09 13:25:53.299823,65114.068441064635
departamento en venta en san rafael con roof garden privado,4450000.0,44.85,,,19.4356867,-99.160168,easyaviso,2025-05-09 13:25:53.299823,99219.62095875139
departamento en venta en cuauhtemoc con roof garden privado,7142500.0,70.0,2.0,2.0,19.4335862,-99.1698593,easyaviso,2025-05-09 13:25:53.299823,102035.71428571429
departamento en venta en cuauhtemoc con balcon,7550000.0,80.5,,2.0,19.4284411,-99.1690587,easyaviso,2025-05-09 13:25:53.299823,93788.8198757764
departamento en venta con balcon y dos habitaciones en la cuauthemoc,5450000.0,71.51,,2.0,19.4298854,-99.1691796,easyaviso,2025-05-09 13:25:53.299823,76213.11704656691
preventa departamentos tipo loft en san rafael cdmx,2729580.0,36.0,,,19.4374601,-99.1618309,easyaviso,2025-05-09 13:25:53.299823,75821.66666666667
departamento en venta rio guadalquivir col. cuauhtemoc,6450000.0,81.2,2.0,2.0,19.4307278,-99.1711649,easyaviso,2025-05-09 13:25:53.299823,79433.49753694581
departamento en venta a. insurgentes nte. cuauahtemoc cdmx,1860000.0,52.0,,2.0,19.4545879,-99.1519871,easyaviso,2025-05-09 13:25:53.299823,35769.230769230766
departamento en venta con un vista espectacular,7900000.0,109.49,2.0,3.0,19.4413563,-99.1802147,easyaviso,2025-05-09 13:25:53.299823,72152.70800986391
departamento 2 recamaras en san rafael,3800000.0,61.0,2.0,2.0,19.4415191,-99.1653955,easyaviso,2025-05-09 13:25:53.299823,62295.08196721312
departamento en venta colonia cuauhtemoc,8500000.0,120.0,2.0,3.0,19.4331818,-99.1661263,easyaviso,2025-05-09 13:25:53.299823,70833.33333333333
departamento en venta a una calle del angel de la independencia.,6250000.0,100.0,2.0,2.0,19.4270245,-99.1676647,easyaviso,2025-05-09 13:25:53.299823,62500.0
venta de departamento cerca del corredor reforma,6600000.0,85.01,2.0,2.0,19.4304782,-99.1707085,easyaviso,2025-05-09 13:25:53.299823,77637.92495000588
departamento en venta en san rafael 2500000,2500000.0,86.0,,2.0,19.4373262,-99.1617888,easyaviso,2025-05-09 13:25:53.299823,29069.767441860466
exclusivo pent house con roof privado vive el lujo en el corazon de la ciudad,6500000.0,83.0,,,19.4316912,-99.1613396,easyaviso,2025-05-09 13:25:53.299823,78313.2530120482
atractivo studio 26m2  4m2 terraza col. juarez cdmx,2501057.0,26.0,,,19.4249416,-99.1588472,easyaviso,2025-05-09 13:25:53.299823,96194.5
exclusivo studio 27m2  5m2 terraza calle liverpool cdmx,2294697.0,27.0,,,19.4251007,-99.1621342,easyaviso,2025-05-09 13:25:53.299823,84988.77777777778
cuauhtemoc rio rhin venta departamento con balcon,7990000.0,117.7,2.0,3.0,19.4317498,-99.1652508,easyaviso,2025-05-09 13:25:53.299823,67884.45199660152
departamento en venta en san rafael 1 recamara,3550000.0,46.0,,,19.4378062,-99.1644967,easyaviso,2025-05-09 13:25:53.299823,77173.91304347826
departamento en venta en veronica anzures 1 recamaras,4550000.0,60.0,2.0,,19.4375682,-99.1723156,easyaviso,2025-05-09 13:25:53.299823,75833.33333333333
loft doble altura con terraza y roof garden privado,4700000.0,75.0,2.0,,19.4375426,-99.1608172,easyaviso,2025-05-09 13:25:53.299823,62666.666666666664
oficina o departamento con doble altura en san rafael,4350000.0,70.0,,,19.4373262,-99.1617888,easyaviso,2025-05-09 13:25:53.299823,62142.857142857145
